RCONB995,SECURS SOLD UNDR AGRMNTS TO REPURCH
RCONB897,TOTL FIDUCIARY ACCTS-NON-MNGD ACCTS
RCONN065,2 YR PRB DEFAULT AUTO LN 26-30 PCT
RIAD3589,RECVRS ON LNS SECD BY MULTI-FMLY RES
RCONS607,NOTIONAL PRINCIPROUGH FIVE YEARS
RCONF182,LN SCRD BY OWNR OCCPD NFARM NRES NON
RCFDS597,NOTIONAL PRINCIPONE YEAR OR LESS
RCFDB860,AFS(COST): ASSET BACKED SEC - OTHER
RIAD4665,RECOVERIES ON LOANS TO FARMERS
RCON1739,OTHR DOMSTC DEBT SECS-AVL-FR-SLE-AMR
RCONK160,LN RSTRCT DBT CNST LAND DEV MULTI NO
RCFDHJ82,LOANS AND LEASES, NET OF UNEARNED IN
RCFD8706,PURCHSD FGN EXCHG CONTRACTS-EXCH TRD
RCFDHT51,US government agency obligations (ex
RCONM711,RE CNSTR LN ALLW BAL: COLL IMPAIRMNT
RCFDF689,AMT DTRM TOT FV RC LN CMTMT
RCONK216,OTHR LN TO IND HH FAM PD 30 - 89
RCONG569,OTHR $25K 25PCT NON TRDING DRVT LVL 
RCOND997,PERFORMANCE STANDBY LETTERS OF CREDI
RCONK061,LS SHR FDIC CLS END FAM SECD JR PD 9
RCFDJ253,FID REL AST INV MGMT ADVIS NMG AST
RCONHK01,OVER-THE-COUNTER DERIVATIVES, ALLOCA
RCFD3548,TRADING LIABILITES
RCFDS453,LOANS AND LEASES WEIGHT CATEGORY
RCONS560,TOTAL ASSETS, DE WEIGHT CATEGORY
RCFDS621,NOTIONAL PRINCIPONE YEAR OR LESS
TEXTB526,RESTATEMNTS DUE TO CORRECTIONS (1ST)
RCFDS559,TOTAL ASSETS, DE WEIGHT CATEGORY
RCFDG572,1ST GT $25K 25PCT OTHR LIAB LESS DTR
RCONB838,HTM(COST): ABS - CREDIT CARD RECEIV
RCONHT65,Assets, Loans, Loans to individuals 
RCFDG401,NTL AMT REG CAP CVRD MRR SL PRTC
RCFDG556,3RD GT $25K 25 PCT OTHR MEASURE FV R
TE02N529,TRD NM OTR THN LGL TTL ID INST DEPS
RCFDG093,BEST EST AT ACQUISITION DT LN SCTY B
RCONK275,CREDIT CARD LN HOUSE FAMILY PD 90
TEXT5593,2ND ITMZD&DESCRPTN LINE CPNT OF 5591
RCONG356,SFP CORP & SIMILAR LN HTM AMRTZ COST
RCFDK143,MBS CMRL PT SCTY GUAR FNMA HTM FV
RIADB910,OTH FIDUCIARY/RELATED SERVICES INCME
RCONG464,BK CUST OTHR SRVC SL PRCH SCTY?
RCFDN002,2YR PRB DFLT 1-4 FM JNR LN 18-20 PCT
RCON8737,GRS NEGTV FAIR VALU OF INT RATE CNTR
RCFD8715,PURCHSD EQTY DERIVATIV CONTRACTS-OTC
RCONK112,LN RSTR SECD CNSTRTN MULTI PD 90
TEXTG571,1ST GT $25K 25 PCT OTHR LIAB FV
RCON8725,TOTL INT RATE CONTRCS-MKD TO MARKET
TEXTG556,3RD GT $25K 25 PCT OTHR MEASURE FV R
RCFD3163,GOODWILL
RCFDG579,2ND GT $25K 25 PCT OTHR LIAB LVL 2 F
RCONG413,NTL PURC CR PRTC INV MAT 1T5 YR
RCONK039,GUAR LN EXCL REBOOK GNMA LN PD 30 - 
RCONS614,NOTIONAL PRINCIP OVER FIVE YEARS
RCONJ471,PRIN AMT SOLD PROPRIETARY REVERSE MT
RCFDHU10,Maximum amout of credit exposure ari
RIADJH99,Balance at end of current period, Av
RCONK190,ASSET SHR FDIC OTHR RE MULTI RES
RCFDC027,AFS(FAIR):TOTL ASSET-BACK SEC -DERV
RCFDS525,UNUSED COMMITMEN OR OTHER AMOUNT
RCFDF658,1ST ITEMIZED AMT FOR OTHR TRDG ASTS
RCONN012,2YR PRB DFLT RV 1-4 FM LN 4-7 PCT
RIADB756,RECOVERIES ON ASSETS SLD,ETC:CR CARD
RIAD4464,1ST ITEMIZED AMT OV25% OF ITEM 4092
RCFDS567,TOTAL ASSETS, DE WEIGHT CATEGORY
RCONN087,2YR PRB DFLT OTH CNS LN  4-7 PCT
RCOA2170,TOTAL ASSETS
RCONM991,2YR PRB DFLT 1-4 FM 1ST LN UNSCORE
RCONS480,TOTAL ON-BALANCE-SALE SECURITIES
RCFDH293,ALL OTHER ASSETS - 250 PCT RISK WGT
RCONG553,2ND GT $25K 25 PCT OTHR FV RCR LVL 1
RCONFT35,RECEIVABLES FROM FORECLOSED GOVERNME
RCONB896,TOTL FIDUCIARY ACCTS-# MNGD ACCOUNTS
RCFDS540,UNCONDITIONALLY  OR OTHER AMOUNT
RCONF237,TOTAL ALLOWABLE EXCLUSIONS INCLD FOR
RIADC908,ADJMTS TO PRETAX INC FOREIGN OFFICES
RCONN095,2YR PRB DFLT OTH CNS LN  26-30 PCT
Unnamed: 87,nan
OCC Charter Number,0
RCONL186,PURCH CREDIT IMPR LN CARRY PD 30 - 8
RCFDS598,NOTIONAL PRINCIPROUGH FIVE YEARS
RCFDN001,2YR PRB DFLT 1-4 FM JNR LN 16-18 PCT
RCFDJF84,Assets of consoidated variable inter
RCONK111,LN RSTR SECD CNSTRTN MULTI PD 30 - 8
RIADFT28,DISCONTINUED OPERATIONS NET OF TAX
RIAD4340,NET INCOME
RCONS459,LOANS AND LEASES WEIGHT CATEGORY
RIADB905,EMPLOYEE BENEFIT-DEFINED CONTRIBUTN
RCFDJJ30,Amount of allowances for credit loss
RCFDA591,OTSTDNG PRIN BAL LNS OTH TH 1-4 FAML
TE03N528,URLS PUB WEB TO ACCPT OR SOLICT DEPS
RCFD8742,GR POS FR VAL OF FGN EXCH-MKD TO MKT
RCONF263,LEVEL 3 FAIR VALUE LOAN COMMITMENTS
RCONG322,MBS OTHR OTHR RES MBS AFS AMRTZ
RCFDC411,N/ACCRUAL ASSETS SOLD DURING QUARTER
RCON8715,PURCHSD EQTY DERIVATIV CONTRACTS-OTC
RCONG381,TRDG ASSET MBS OTHR RES MBS
RCONHT89,Loans measured at fair value, Loans 
RCONK125,LN RSTR CMRL IND LN NUS ADR NACRL
RCONS524,ALL OTHER OFF- B WEIGHT CATEGORY
RCFDS462,LOANS AND LEASES WEIGHT CATEGORY
RCONC002,CORP TRST&ACY ACCTS-# NON-MNGD ACCTS
RCON2160,OTHER ASSETS
RCFD5377,LNS TO US BKS,ETC.-PAST DU 30-89 DYS
RCFDN030,SEC HIGHER RISK C&I LOANS
RCONN071,2 YR PRB DEFLT STUDENT LN 1-4 PCT
RCFD5368,ALL OTH LNS SECD BY 1-4FMLY-JR LIENS
RCFDC973,CRD DERIVTS:NOTL AMTS-CRDIT OPTIONS-
RCFDB885,CORP TRST/AGCY ACCTS-NON-MNGD ASSETS
RCFDG581,3RD GT $25K 25% OTHR LIAB FV
RIADC894,OTHR CNSTRCTN LN & LAND DEV RECOVERI
RCFDG374,SFP OTHR CLTRL REF ASSET AFS AMRTZ
RCONF686,AMT DTRM TOT FV RC FOR DEP
RCONJ292,MG FID OTHR NT BND ALL OTHR
RCFDJ269,MG FID US TREAS OBGL PRSNL TR INV MG
RCON3230,COMMON STOCK
RCONB895,TOTL FIDUCIARY ACCTS-NON-MNGD ASSETS
RCONHJ93,FINANCIAL STANDBY LETTERS OF CREDIT,
RCONG097,FV LN LEASE ACQUISITION LN TO IND HH
RCONH186,ALLOCATION BY RIARDIZED CHARGES)
RCOALB60,LESS: DTAs arising from temporary di
RCONHT81,Retail originations during the quart
Unnamed: 34,nan
RCFDG304,MBS RPTS ISS FNMA FHLMC HTM AMRTZ
RCFDHU09,Maximum amout of credit exposure ari
RCONH288,LOANS AND LEASES WEIGHT CATEGORY
RCFDD987,TOTAL BALANCE SHEET ASSETS - 0 PCT R
RCONN072,2 YR PRB DEFLT STUDENT LN 4-7 PCT
RCONM710,RE CNSTR LN RECD INVST:COLL IMPARMNT
RCONG369,SFP DVRS (MIXED) POOLS SFP HTM FV
TEXTC875,4TH CONTACT-USA PATRIOT ACT-NAME
RCONN091,2YR PRB DFLT OTH CNS LN  16-18 PCT
RCON6165,NBR OF EXEC OFFCRSEPRIN SHAREHOLDERS
RIAD4060,INT&DIV INC ON: ALL OTHER SECURITIES
RCFDJ314,CORP TR ACT CORP MUNI TR PRIN AMT OU
RCFDG427,OTC FV CSH USD CORP OTHR CNTRPRTY
RCONN109,2YR PRB DFLT CONS LEASES 22-26 PCT
RCONJ307,MG FID MISC AST OTHR
RCFDK149,MBS CMRL PT SCTY OTHR AFS FV
RCONK652,AVG CNSL TOTAL ASSET CALENDAR QTR
RCFDF057,FHLB ADVS:RMNG MAT/REPRNG DT 3-5 YRS
RIADC234,CHRG-OFFS CLSD-END:SECURED 1ST LIENS
RCON1256,C&I LNS TO NONUS ADR,NONACCRUAL
RCFDH290,TRADING ASSETS E WEIGHT CATEGORY
OTS Docket Number,16553
RCFDS451,LOANS AND LEASES WEIGHT CATEGORY
RCONG537,OTHR GT 25K & 25 PCT MTG SVC RT LESS
RCFDM719,RE CMRL LN REC INVST PUR CR IMPARMNT
RCONA551,SECS ISD BY US TREAS,ETC OV 1-3 YRS
RCONN117,2YR PRB DFLT TOTAL LN  4-7 PCT
RCONS437,LOANS AND LEASES WEIGHT CATEGORY
RCONL135,INST COMPLY W HOLA QLT OR IRS DBLA
RCONK036,LN GUAR US , EXCLUD FDIC PD 30 - 89
RCFDG443,OTC FV CORP BONDS BK & SCTY FIRM
RCONS483,ON-BALANCE SHEETTION METHODOLOGY
RCONS439,TOTAL LOANS AND TGAGE EXPOSURES
RCONS528,UNUSED COMMITMEN WEIGHT CATEGORY
RCFD8695,FUTURES EQTY DERIVATIVE CONTRACTS
RCFDN089,2YR PRB DFLT OTH CNS LN  10-14 PCT
RCFDH276,LOANS AND LEASES WEIGHT CATEGORY
RCFDM748,TOTAL RECORDED INVST: COL IMPAIRMNT
RCFDA346,FIDCRY PWRS GRTD&EXERCSD NO DOLR RPT
RCONB874,EMPLOYEE BNFT-DEFND CNTRBTN-# MANAGD
Unnamed: 52,nan
RCONHJ78,LOANS AND LEASES HELD FOR SALE, EXPO
RCFDS563,TOTAL ASSETS, DE WEIGHT CATEGORY
RCFDG408,NTL SL CR PRTC INV MAT GT 5 YR
RCONF061,OT BRWD MNY:WT RMNG MAT/REPR DT 1-3 
RCFDG617,RETAINED RESOURCE ON SMALL BUSINESS
RCONN099,2YR PRB DFLT OTH CNS LN PD DRVED
RCONM963,NON-AGENCY RESIDENTIAL MBS
RCONF158,LN SECURED BY 1-4 FAM RES CONSTRUCTI
RCFDHU18,Total amount of ownership (or seller
RCFDC972,CRD DERIVTS:NOTL AMTS-CRD OPTIONS-GU
RCONG623,ALL OTHER OFF- BALANCE SHEET LIABILI
RCFD1764,C&I LOANS, NON-U.S. ADDRESSEES
RCFDS488,ON-BALANCE SHEETLCULATION METHOD
RCFDF058,FHLB ADVS:RMNG MAT/REPRNG DT OVR 5 Y
RCONK057,LS SHR FDIC CLS END FAM SECD 1ST 30-
RCFDH174,ALLOCATION BY RIESTATE EXPOSURES
RCONHT57,Mortgage backed securities (MBS), Is
RCONS621,NOTIONAL PRINCIPONE YEAR OR LESS
RCFDS583,NOTIONAL PRINCIPROUGH FIVE YEARS
RCONB557,ALL0WANCE FOR CREDIT LOSSES OFF B/S
RCFDJJ03,Allowance for credit losses on other
RCON3533,TRDG ASSETS-SECS ISSD BY ST  POL SUB
RCFDB727,REPRTNG BNK'S UNUSD CMMTMTS-HM EQ LN
RCFDJ273,MG FID ST CTY MUNI EMPL BNFT REL TR
RCFN5513,ALL OTHR RE OWNED IN FOREIGN OFFICES
RCONB746,PAS DUE LN AMTS:90 DYS/MOR ALL OTHER
RCONS561,TOTAL ASSETS, DE WEIGHT CATEGORY
RCFAQ257,UNREALIZED GAINS ON A-F-S EQUITY SEC
RCFDHT67,Unpaid principal balance of loans me
RCFD3530,REPLMT COST OF CONTRCTS-PAS DU 90 DY
RIAD4073,TOTAL INTEREST EXPENSE
RCFDM998,2YR PRB DFLT 1-4 FM JNR LN 10-14 PCT
RCFW5311,TIER 2 (SUPPLEMENTARY) CAPITAL
RCONS505,TOTAL BALANCE SHEET ASSETS - 3 WEIGH
RCONK162,LN DBT LAND DEV NFARM NRES SCD NFARM
RCONK038,LN GUAR US , EXCLUD FDIC NACRL
RCONN015,2YR PRB DFLT RV 1-4 FM LN 14-16 PCT
RCONB834,P/D(30-89DA):LOANS TO DI'S - DERIVED
RCFDK213,AUTO LN TO IND HH FAM PD 30 - 89
RCFD8783,FAIR VALUE OF STRUCTURED NOTES
RCONS554,CENTRALLY CLEARE WEIGHT CATEGORY
RCONJ304,MG FID RE OTHR
RCON8745,GR NEG FR VAL OF INT RATE-MKD TO MKT
RCONG636,RISK-WEIGHTED ASSETS BY RISK-WEIGHTE
RCFDHU22,Assets of considated variable intere
RCFDS562,TOTAL ASSETS, DE WEIGHT CATEGORY
RCONJJ21,Held to Maturity Securities, Mortgag
RCFDH281,LOANS AND LEASES WEIGHT CATEGORY
RCONK153,MBS CMRL OTHR CMRL GUAR FNMA AFS FV
RCFDB534,LNS TO OTH DEPSTRY INSTITNS IN U.S.
RCONHK12,MATURITY AND REPRICING DATA FOR TIME
RCFDJ285,MG FID CMN TR FUND EMPL BNFT RETIRE 
RCFNB901,FID ACCTS HLD IN FRGN OFFS-NON-MANGD
RCONFT00,DOES THE INSTITUTION HAVE ANY DERIVA
RCONL189,LN RESTRUCTURED IN TDR THAT COMPLY
RCFD8726,TOTL FGN EXCH CONTRCS-MKD TO MARKET
RIADB960,TOT FIDU SETTLEMTS,ETC-GROS LOSS NON
RCFD3401,QTLY AVG OF ASSETS HELD IN TRDG ACCT
RCFDF061,OT BRWD MNY:WT RMNG MAT/REPR DT 1-3 
RCFDK040,GUAR LN EXCL REBOOK GNMA LN PD 90
RCONS512,PERFORMANCE STAN WEIGHT CATEGORY
RCOAP842,LESS INTANG ASSTS NET OF ASSCTD DTLS
RCONB797,MAXI AMT OF CREDIT,ETC:1-4 FAM RSDTL
RCFDG540,OTHR GT 25K 25 PCT MTG SVC RT LVL 3 
RCONJJ18,Loans and Leases, Held for Investmen
RCONFT19,PAST DUE AND NONACCRUAL LOANS AND LE
RCONH298,EF FUND CONTRBTNS CNTRL CNTRPRTIES
RCFDG105,TOT EQT CAP INC NONCTRL MINORITY INT
RCONG400,FOREIGN DEBT SCTY FV AFS SCTY
TEXT9116,FAX_NR
RCFDH278,LOANS AND LEASES WEIGHT CATEGORY
RCOND979,TRADING ASSETS
RCFDA248,FXD&FLTG RT DEBT SECS MAT 1 YR OR LE
RCFDJ308,MG FID TOT MGMT FID PRSNL TR AGY INV
RCFAP868,CAP MNRTY INTRST NOT INCL TIER 1 CAP
RCONH180,ALLOCATION BY RIESTATE EXPOSURES
RCONB878,EMPLOYEE BNFT-DFND BNFT-# MNGD ACCTS
RCFDA558,MTGE PASS-THRU SECS MAT OV 3 - 5 YRS
RCON3123,ALLL_AMT
RCFDS607,NOTIONAL PRINCIPROUGH FIVE YEARS
RCONN021,2YR PRB DFLT RV 1-4 FM LN GT 30 PCT
RCONK058,LS SHR FDIC CLS END FAM SECD 1ST PD 
RCFDN058,2YR PRB DFLT AUTO LN 7-10 PCT
RCON3632,UNDIVIDED PROFITS & CAPITAL RESERVES
RCFD8748,GR NEG FR VAL OF CMDY&OTH-MKD TO MKT
RCFDG333,SFP CORP SIMILAR LN
RCONC222,NOTNL AMT-BENEFICIARY:GROS NEG FR VL
RCONM751,TOTAL ALLOWANCE BAL:PUR CR IMPAIRMNT
RCONG410,NTL SL CR PRTC SUBINV MAT 1T5 YR
RCONK139,ITEMIZE LN FINANCE AGRI FARM PD 90
RCFDB932,DOMESTIC EQUITY-MKT VAL FUNDS ASSETS
RCOAH314,DIST AND DISCRE BONUS PAYMENTS QTR
RCONHK17,LIABILITIES, NONTRANSACTION ACCOUNTS
RCFDK663,CRITICIZED CLASSIFIED SPECIAL
Unnamed: 160,nan
RCFDH289,TRADING ASSETS E WEIGHT CATEGORY
RCONA570,OTHER LNS&LEASES MAT 3 MONTHS OR LES
RCONN082,2 YR PRB DEFLT STUDENT LN UNSCORE
RCONB561,QTR AVG: CREDIT CARD LOANS
RCFDH309,OVER-THE-COUNTER WEIGHT CATEGORY
RCON3500,LNS SECD BY MULTIFAMILY-PST DU 90DYS
RCFDG422,OTC DRVT CR EXP CORP OTHR CNTRPRTY
RCONA568,CLSD-END LNS SECD 1ST LIENS OVR 15 Y
RCONB790,ASSTS SLD W/RECOURSE,ETC:1-4 FAM RSD
RCONG099,BEST EST AT ACQUISITION DT LN TO IND
TEXTC375,SECONDARY CONTACT - FAX
RCONK062,LS SHR FDIC CLS END FAM SECD JR NACR
RCONB935,STOCK/BOND BLEND - NUMBER OF FUNDS
RCONS443,LOANS AND LEASES WEIGHT CATEGORY
RCFDH177,ALLOCATION BY RIESTATE EXPOSURES
RCFDG452,OTC FV EQUITY SCTY CORP OTHR CNTRPRT
RCFDB781,MAXI AMT OF CREDIT,ETC:CMMRCL&INDUST
RCFDG498,OTHR TRDG ASSET LESS AMT NET FV
RCFDG637,RISK-WEIGHTED ASSETS BY RISK-WEIGHTE
RCONK119,LN RSTR SECD NONFARM NONRES NACRL
RCFDN057,2YR PRB DFLT AUTO LN 4-7 PCT
RCONFT03,FOR THE TWO CALENDAR QUARTERS PRECED
RCFDM724,RE RESD LN ALLW BAL: COLL IMPAIRMNT
RCFDK128,LN RSTR ALL OTHR LN LEASE NACRL
RCFDG388,PLDG TRDG ASSET PLDG LN CNSL BK
RCFDK126,LN RSTR ALL OTHR LN LEASE PD 30 - 89
RCFDM725,RE RESD LN REC INVST PUR CR IMPARMNT
Unnamed: 13,nan
RCONB892,OTH FIDUCIARY ACCTS-# MANAGED ACCTS
RCONG548,1ST GT $25K 25PCT OTHR FV RCR LVL 1 
RCFDF164,1-4  FAM RES CNSTRCTN LN COMMITMNTS
RCFDG450,OTC FV EQUITY SCTY HEDGE FUNDS
RCONG394,OTHR MBS ISS FFG FV AFS SCTY
RCON1754,HELD-TO-MATURITY SECURITIES
RCONHJ77,SECURITIES, AVAILABLE-FOR-SALE DEBT
RCONF576,LN SEC 1-4 RES PROP IN DMST OFC
RCFD2107,OBLGS OF ST&POLITICAL SUBDVS IN U.S.
RCONG313,MBS OTHR RES ISS GUAR FFG HTM FV
RIADHT73,Noninterest income: Fees and commiss
RCFDK216,OTHR LN TO IND HH FAM PD 30 - 89
RCONG411,NTL SL CR PRTC SUBINV MAT GT 5 YR
RCFAKX78,Trading assets and trading liabiliti
RCFDM741,OTHR CONS LN RECD INVST COL IMPARMT
RCFDG560,3RD GT $25K 25 PCT OTHR FV RCR LVL 3
RCON5595,4TH ITMZD&DESCRPTN LINE CPNT OF 5591
RCON3553,2ND ITM AMT FOR OTH LB OV25% OF 2930
RCFDH272,TOTAL AVAILABLE-FOR-SALE SECURITIES
RCONK163,LN RSTRCT DBT CMRL US ADR
RCFDG356,SFP CORP & SIMILAR LN HTM AMRTZ COST
RCONFT20,PAST DUE AND NONACCRUAL LOANS AND LE
RCFDL194,CNSLD TOT LIAB BEFORE EXCLUSIONS
RCONC012,DERIVATATIVES W/NEGATIVE FAIR VALUE
RCON1590,LOANS TO FINANCE AGRICULTURAL PROD
RIADB949,PERSONAL TRUST/AGCY ACCTS-RECOVERIES
RIADB748,CHRG-OFFS ON ASSETS SOLD ETC HM EQTY
RCONK653,AVG METHOD USED
RCFDG578,2ND GT $25K 25 PCT OTHR LIAB LVL 1 F
RCFDK042,REBOOK GNMA LN REPURCH PD 30 - 89
RCOAP870,TIER 2 CAPITAL BEFORE DEDUCTIONS
RCON3386,QTLY AVG OF LNS TO FINC AGRCL PROD
RCFDB940,MUNICIPAL BOND-MK VAL OF FUND ASSETS
RCON5583,OTSTDG BAL > $250,000 THRU $500,000
RCONG556,3RD GT $25K 25 PCT OTHR MEASURE FV R
RCFDS460,LOANS AND LEASES WEIGHT CATEGORY
RCFDG396,ALL OTHR ASSET LVL 2 FV MEASURE
RCFD5367,ALL OTH LNS SECD BY 1-4FMLY-1ST LIEN
RCFDJ276,MG FID MMMF EMPL BNFT RETIRE REL TR
RCFDS572,RISK-WEIGHTED AS WEIGHT CATEGORY
RCONG590,4TH GT $25K 25 PCT OTHR LIAB LVL 3 F
RCONJ282,MG FID OTHR MF EMPL BNFT RETIRE REL 
RCFD2130,INVEST. IN UNCONSOLIDATED SUBS & CO.
RCFDG488,LN & LEASE HELD INV TOTAL FV RPT
RCON3656,DIRECT INDIRECT INV IN RE
RCONB890,OTHER FIDUCIARY ACCTS-MANAGED ASSETS
RCFDG624,UNUSED COMMITMENTS, ORIGINAL MATURIT
RCFDG474,AFS SCTY LESS AMT NET IN DETER FV
RCFDK150,MBS CMRL OTHR CMRL GUAR FNMA HTM AMT
RCONJ274,MG FID ACT ST, CTY, MUNI OBGL OTHR
RCONN050,2YR PRB DFLT CRDT CRD LN  26-30 PCT
RCONN124,2YR PRB DFLT TOTAL LN  22-26 PCT
RCFDN055,2YR PRB DFLT AUTO LN LE 1 PCT
RCFD8720,NOTIONAL VALUE OF COMMODTY&OTH SWAPS
RCONS424,LOANS AND LEASESRTED IN COLUMN A
RCFDN070,2 YR PRB DEFLT STUDENT LN LE 1 PCT
Unnamed: 80,nan
RCFDJA29,Cost of equity securities with readi
RCONS425,LOANS AND LEASES WEIGHT CATEGORY
RIADC899,TOTAL INTEREST INCOME IN FOREIGN OFF
RIADC890,GAIN/LOSS ON CR DERIVATIVES HLD FOR 
RCONF177,OTHER CNSTRCTN LN NONACCRUAL
RCFDHK26,TOTAL LOANS RESTRUCTURED IN TROUBLED
RCFDHU23,Assets of considated variable intere
RCFD3547,TRDG LIABS-REVALUATN LOSS ON INT RTE
RCON2150,OTHER REAL ESTATE OWNED
RCONG379,TRDG MBS PT SCTY ISS GUAR FFG
RCFDS480,TOTAL ON-BALANCE-SALE SECURITIES
RCFDJ267,MG AST FID INT DEP EMPL BNFT RETIRE 
RCONH307,UNUSED COMMITMEN WEIGHT CATEGORY
RCFDS593,NOTIONAL PRINCIP OVER FIVE YEARS
Financial Institution Filing Type,51
RCFD8694,FUTURES FGN EXCHG CONTRACTS-NOTIONAL
RIADC891,1-4 FAM RES CNSTRTN LN CHARGE-OFFS
RCOAKX78,Trading assets and trading liabiliti
RCONHU21,Assets of considated variable intere
RCON8712,WRITTEN COMMODITY&OTHR CONTRACTS-OTC
RCFWP851,NNSG INVCP UNCNS COMSTK 10 PCT THRSH
RCONN018,2YR PRB DFLT RV 1-4 FM LN 20-22 PCT
RSSD9200,STATE_ABBR_NM
RCONS548,OVER-THE-COUNTER WEIGHT CATEGORY
RCFDS554,CENTRALLY CLEARE WEIGHT CATEGORY
RCONH303,UNUSED COMMITMEN WEIGHT CATEGORY
RCFDN021,2YR PRB DFLT RV 1-4 FM LN GT 30 PCT
RCFDG416,NTL PURC CR PRTC SUBINV MAT 1T5 YR
RCFDG436,OTC FV US TREAS SCTY SOVEREIGN GOVT
RCONM740,OTHR CONS LN ALLW BAL:INDV IMPAIRMNT
RCFDHK27,TOTAL LOANS RESTRUCTURED IN TROUBLED
RCON2122,TOT LNS&LEASE LESS UNEARN INC ON LNS
RCONF624,OTHER TRADING LIABILITIES (CONSOLIDA
RCONS598,NOTIONAL PRINCIPROUGH FIVE YEARS
RCFAP857,INSF TIER1 TIER2 CAP CVR DED
RCONJ272,MG FID ST CTY MUNI PRSNL TR INV MGMT
RIADB526,RESTATEMNTS DUE TO CORRECTIONS (1ST)
RCON5398,RVLVG,OPEN-END LNS-PAST DU 30-89 DYS
RCFWA223,RISK-WEIGHTED ASSETS
RCFDJ278,MG FID EQMF PRSNL TR AGY INV MGMT
RCFD8719,NOTIONAL VALUE OF EQTY DERVTIV SWAPS
RCONG567,OTHR $25K 25 PCT NON TRDING DRVT LES
RCFDHT63,Assets, Loans, Loans secured by real
RCFDN029,HIGHER RISK C&I LOANS
RCONB858,HTM(COST): ASSET BACKED SEC - OTHER
RCONN084,2 YR PRB DEFLT STUDENT LN DRVED
RCFDJ296,MG FID OTHR CMN PRF STK PRSNL TR INV
RCFDK153,MBS CMRL OTHR CMRL GUAR FNMA AFS FV
RCOND957,TOTAL CASH AND BALANCES DUE FROM DEP
RIAD4643,CHG-OFFS ON LNS TO FGN GOVTS & INST
RCONG619,ALL OTHER OFF- BALANCE SHEET LIABILI
RCONN064,2 YR PRB DEFAULT AUTO LN 22-26 PCT
RCONM975,2 YR PRB 1-4 FM RES ASSMNT GT 30
RCONH179,ALLOCATION BY RIESTATE EXPOSURES
RCONS571,RISK-WEIGHTED AS WEIGHT CATEGORY
RCONH304,UNUSED COMMITMEN WEIGHT CATEGORY
RCONLL60,Outstanding balance of borrowings fr
RCFDH271,TOTAL AVAILABLE-FOR-SALE SECURITIES
RIADC233,ADJUSTMENTS
RCONF230,TOTAL CARRY AMT OF CLS-END LN NEG AM
RIADC911,NET INC ATTRIBUTABLE TO FRGN OFFICES
RCONH295,ALL OTHER ASSETS - APPRO RISK WEIG
RCONN059,2YR PRB DFLT AUTO LN 10-14 PCT
RCONC391,OTSTDNG CRED CD FEES & FIN CHGS
RCONS541,UNCONDITIONALLY QUIVALENT AMOUNT
RCFDB786,RPRTNG BNK'S UNUSD CMTMTS:AUTO LOANS
RCONA511,FAIR VAL OF AVL-FOR-SL INVES MUTL FD
RCFDN116,2YR PRB DFLT TOTAL LN  1-4 PCT
RCFDG577,2ND GT $25K OTHR LIAB LESS DTRM FV
RCFDG348,SFP TPS ISS FNC INST HTM AMRTZ COST
RCONK146,MBS CMRL PT SCTY OTHR HTM AMTRZ
RCFD5391,LNS TO FGN GOV,ETC.-NONACCRUAL
RCONN060,2YR PRB DFLT AUTO LN 14-16 PCT
RIADB952,RETIREMT RELATED TRST,ETC-RECOVERIES
Unnamed: 8,nan
RCONN081,2 YR PRB DEFLT STUDENT LN GT 30 PCT
RCFDM978,2 YR PRB 1-4 FM RES ASSMNT PD DERVD
RCFDK215,AUTO LN TO IND HH FAM NONACCRUAL
RCON3164,MORTGAGE SERVICING ASSETS
RCONHT61,Asset-backed securities and structur
RCON3557,3RD CP OF OT OFF BALANCE SHEET LIABI
RCONG615,RETAINED RESOURCE ON SMALL BUSINESS
RIADC903,NONINT INC FRG OFFCS:INVMT BKG,ADVRY
RCONJ286,MG FID CMN TR FUND OTHR
RCFDK122,LN RSTR CMRL IND LN US ADR NACRL
RCONA130,OTHER COMPONENTS OF EQUITY CAPITAL
RCFDK194,CPTV INS SUB TOTAL ASSET CPTV REINS 
RCFDJ260,FID REL AST IRA, HSA, OTHR NMG AST
RCONK656,BANKER'S BANK CERTIFICATION
RCFDHJ98,UNUSED COMMITMENTS WITH AN ORIGINAL
RCFDG402,NTL AMT REG CAP CVRD MRR PURC PRTC
RCONK256,LN RSTRCT DBT CMRL
RCFDG440,OTC FV USGOV AGCY HEDGE FUNDS
RCONN002,2YR PRB DFLT 1-4 FM JNR LN 18-20 PCT
RCFDS552,CENTRALLY CLEARE WEIGHT CATEGORY
RCFDS522,REPO-STYLE TRANS WEIGHT CATEGORY
RCONK198,TRDG ASSET MBS ALL OTHR MBS
RCFD8713,PURCHSD INT RATE CONTRACTS-OTC
RCON3434,WHEN-ISSUED SEC-GROSS COMMIT TO PURC
RCFD3550,2ND ITM AMT FOR OTH AS OV25% OF 2160
RCONM749,TOTAL ALLOWANCE BAL: COL IMPAIRMNT
RCONG092,GROSS CONTRACT RCVBL LN SCTY BY RE
RCONS428,LOANS AND LEASES WEIGHT CATEGORY
RCONG627,UNUSED COMMITMENTS, ORIGINAL MATURIT
RCFDF660,3RD ITEMIZED AMT FOR OTHR TRDG ASTS
RCONN520,RMT TRSFR MECH ABRD RPT DT OTR PRTY
RCONG502,TOT ASSET MEASURE FV RCR FV RPT
RCONG315,MBS OTHR RES ISS GUAR FFG AFS FV
RCONJ310,MG FID TOT AST MGMT FID OTHR
RCONG412,NTL PURC CR PRTC INV MAT LE 1 YR.
RCONB945,TOT COLLECTVE INVMT FUNDS-# OF FUNDS
RCFDN027,HIGHER RISK CONSUMER LNS
RCONH274,LOANS AND LEASES WEIGHT CATEGORY
RCONB855,HTM(FAIR): ABS- COMMRCIAL &IND LOANS
RCONG497,OTHR TRDG ASSET TOTAL FV RPT
RCOND985,ALL OTHER ASSETS - 100 PCT RISK WEIG
RCON8696,FUTURES COMMODITY&OTHER CONTRACTS
RCONG566,OTHR $25K 25 PCT NON TRDING DRVT FV 
RCFDF170,ALL OTHR LEASE PAST DUE > 90 DAYS
RCONC236,CLSD-ED LNS:SEC 1 LIENS PA DU 30-89
RCFD0090,BALANCES WITH F. R. BKS (COML BK BOO
RCFDS429,LOANS AND LEASES WEIGHT CATEGORY
RCFDM742,OTHR CONS LN ALLW BAL: COL IMPAIRMNT
RCON5381,LNS TO FOREIGN BKS-PAST DU 90 DYS OR
RIADB511,OTHER COMPREHENSIVE INCOME
RCONK173,ASSET SHR FDIC LN SCD FAM CLS SCD 1S
RCFDG554,2ND GT $25K 25 PCT OTHR FV RCR LVL 2
RCFDM971,2YR PRB DFLT 1-4 FM RES LN 18-20 PCT
RCONB562,QTR AVG: OTHER LOANS TO INDIVIDUALS
RCONG550,1ST GT $25K 25 PCT OTHR FV RCR LVL 3
RCONH284,LOANS AND LEASES WEIGHT CATEGORY
RCOND989,TOTAL BALANCE SHEET ASSETS - 50 PCT
RCFDJ298,MG FID OTHR CMN PRF STK OTHR
RCON9999,MICR9999REPORT DATE
RCFDC407,OUTSTNG CRD CRD FEES & FIN CHRGS
RCONF233,IRA KEOGH IN MEM ITEM 2.C
RCFD3210,TOTAL EQUITY CAPITAL
RCFDB859,HTM(FAIR): ASSET BACKED SEC - OTHER
RCFDS458,LOANS AND LEASESRTED IN COLUMN A
RCONS455,LOANS AND LEASES WEIGHT CATEGORY
RCONH280,LOANS AND LEASES WEIGHT CATEGORY
RCONM728,CMRL LN ALLW BAL: INDV IMPAIRMNT
RCFDH172,ADJUSTMENTS TO TEMENTS TO RESELL
RCFDA573,OTHER LNS&LEASES MAT OVR 3 - 5 YRS
RCFDJ981,ASST CNSL VIE CASH DUE FROM DI SCTY 
RCFDG417,NTL PURC CR PRTC SUBINV MAT GT 5 YR
RCONF063,OT BRWD MNY:WT RMNG MAT/REPR DT OV 5
RCFD1773,AVAILABLE-FOR-SALE SECURITIES
RCON2168,ALL OTHER ASSETS
RCONA554,SECS ISD BY US TREAS,ETC OVER 15 YRS
RCONS484,ON-BALANCE SHEETTION METHODOLOGY
RCONN118,2YR PRB DFLT TOTAL LN  7-10 PCT
RCFD6164,AGGREG AKT OF EXT OF CREDIT TO EXECS
RCFDG100,FV LN LEASE ACQUISITION ALL OTHR
RIADC218,RCVRS ON CLSD-ED LNS:SECURD JR LIENS
RCFDJF77,Total assets of ABCP conduit VIE
RCON3200,SUBORDINATED NOTES AND DEBENTURES
RCON1606,PAST DUE (30-89 DAYS): C&I LOANS
Financial Institution Name,BANK OF HANCOCK COUNTY
RCFDS560,TOTAL ASSETS, DE WEIGHT CATEGORY
RCOAKX83,Total off-balance sheet exposures (s
RCFDH304,UNUSED COMMITMEN WEIGHT CATEGORY
RCONP757,OTHR MMDA INDIV PRTNRS CORPS
RCON8695,FUTURES EQTY DERIVATIVE CONTRACTS
RCONS489,ON-BALANCE SHEETLCULATION METHOD
RIADJ321,OTTI LOSS RECOGNIZED EARNING
TE06N529,TRD NM OTR THN LGL TTL ID INST DEPS
RCFDA552,SECS ISD BY US TREAS,ETC OV 3-5 YRS
RCFDB861,AFS(FAIR): ASSET BACKED SEC - OTHER
RCFDJ461,AMT FDIC LS SHARE AGREEMENT DEBT SCT
RIAD4463,3RD ITEMIZED AMT OV25% OF ITEM 4078
RCON1287,US TREAS SECS-AVL-FOR-SLE-FAIR VALUE
RCFDHT88,Loans measured at fair value, Loans 
RCFDG307,MBS RPTS ISS FNMA FHLMC AFS FV
RCONF174,1-4  FAM RES CNSTRCTN LN PD > 90 DAY
RCONS608,NOTIONAL PRINCIP OVER FIVE YEARS
RCONN521,MECH16A(2) LRGST NUM DEC312013 AFTR
TEXTB963,TELEPHONE:AREA CODE/PHONE #/EXTENSN
RCFDH283,LOANS AND LEASES WEIGHT CATEGORY
RCFD8703,WRITTEN EQTY DERIVATIVE CONTRACTS
RCON3646,OTHER EXPENSES ACCRUED & UNPAID
RCFDJJ15,Loans and Leases, Held for Investmen
RCFDH198,ALLOCATION BY RI (FAILED TRADES)
RCONM717,RE CMRL LN ALLW BAL: COLL IMPAIRMNT
RCFDF639,LN MSRD FV PAST DUE 90 D FV
RCFDG487,LN & LEASE HFS LVL 3 FV MEASURE
RCFDD996,FINANCIAL STANDBY LETTERS OF CREDIT
RCON5400,RVLVG,OPEN-END LNS-NONACCRUAL
RCFW7205,TOTAL RISK-BASED CAPITAL RATIO
RCOND988,TOTAL BALANCE SHEET ASSETS - 20 PCT
RCON1797,REVOLVING, OPEN-END LNS SECD BY 1-4F
RCFDM985,2YR PRB DFLT 1-4 FM 1ST LN 16-18 PCT
RCONJ261,FID REL AST IRA, HSA, OTHR NBR MG AC
RCFDL195,CNSLD TOT ALLOW EXCLUSIONS
RIADB513,RECVRS ON LOANS IN FOREIGN OFFICES
RCON3550,2ND ITM AMT FOR OTH AS OV25% OF 2160
RCFDM731,CMRL LN RECD INVST: PUR CR IMPAIRMNT
RCFD8705,PURCHSD INT RATE CONTRACTS-EXCHG TRD
Unnamed: 41,nan
RCONS597,NOTIONAL PRINCIPONE YEAR OR LESS
RIADB951,RETIREMT RLTD TRST,ETC-GROSS LOS NON
RCONB886,INVMT MNGEMNT AGCY ACCTS-MNGD ASSETS
RCFDF161,LN SECURED BY OTHR NONFARM NONRES PR
RCONN053,2YR PRB DFLT CREDIT CARD LN  TOTAL
RCONS500,TOTAL BALANCE SHEET ASSETS - ARTED I
RCONJ253,FID REL AST INV MGMT ADVIS NMG AST
Unnamed: 47,nan
RCOND993,FINANCIAL STANDBY LETTERS OF CREDIT
RIADC014,EARNINGS ON CSV OF LIFE INSURANCE
RCFD1420,R.E. LOANS-FARMLAND
RCFDB849,AFS(FAIR): ABS - AUTOMOBILE LOANS
RCFDS397,CASH AND BALANCE WEIGHT CATEGORY
RCONN182,US GRN LNS SEC CC LNS TO IND HLD FAM
RCON2165,LEASE FINANCING RECEIVABLES
RIAD9106,ACQUISITION DATE
RCON2203,TOT TRANSACT ACCTS-STS&POL SUB IN US
RCONP754,INTR TRN ACCTS INDIV HSHLD FMLY
RCONG504,TOT ASSET MEASURE FV RCR LVL 1
RCFDF697,LVL 1 FV MSMT FOR LN CMTMT NT DRVT
Unnamed: 46,nan
RCONB804,1-4FAM RES MORTGAGE SERVIC W/RECRS
RCONJ296,MG FID OTHR CMN PRF STK PRSNL TR INV
RCON1420,R.E. LOANS-FARMLAND
RCFDG609,COMMERCIAL AND SIMILAR LETTERS OF CR
RCONH285,LOANS AND LEASES WEIGHT CATEGORY
RCFDG387,PLDG TRDG ASSET PLDG SCTY
RCONB883,OTH RETIREMNT ACCTS-# NON-MNGD ACCTS
RCONA559,MTGE PASS-THRU SECS MAT OV 5 - 15 YR
RCONS416,LOANS AND LEASES WEIGHT CATEGORY
RCONK678,NBRKD DEP GT 250K
RCONG499,OTHR TRDG ASSET LVL 1 FV MEASURE
RCON5368,ALL OTH LNS SECD BY 1-4FMLY-JR LIENS
RCONH296,OTHR ASSETS BK-OWND LIFE INSRNCE
RCONG365,SFP 1T4 RES MBS N I OR G GSE HTM FV
RCFDD980,TRADING ASSETS
RCONH309,OVER-THE-COUNTER WEIGHT CATEGORY
RCFNB903,FID ACCTS HLD FRGN OFFS-# NON-MNGD
RCONK066,LS SHR FDIC LN SECD OWN NFARM PD 30 
RCONB733,PAST DUE LN AMTS:30-89 DYS FAMI RSDL
RIADHT85,Noninterest income for the quarter f
RCFDF653,TRDG ASTS EQT SCTY OTHR
RCONC238,CLSD-ED LNS:SEC JR LIENS PA DU 30-89
RCONHK08,MATURITY AND REPRICING DATA FOR TIME
RCFDK155,MBS CMRL OTHR CMRL OTHR CMRL HTM FV
RCFD5594,3RD ITMZD&DESCRPTN LINE CPNT OF 5591
RCFDK270,LIFE INS ASSET HYBRID ACCNT
RCFDM982,2YR PRB DFLT 1-4 FM 1ST LN 7-10 PCT
RCONB845,AFS(FAIR): ABS - HOME EQUITY LINES
RIADA479,CORPORATE TRUST&AGENCY ACCOUNTS
RCFDB728,RPRTNG BNK'S UNUSD CMTMTS-CR CRD REC
RCONG612,RETAINED RESOURCE ON SMALL BUSINESS
RCONL183,PURCH CREDIT IMPR LN BAL PD 30 - 89
RCFDG357,SFP CORP & SIMILAR LN HTM FV
RCFD1797,REVOLVING, OPEN-END LNS SECD BY 1-4F
RCFDG432,OTC FV CSH OTHR CUR CORP OTHR CNTRPR
RCOND991,FINANCIAL STANDBY LETTERS OF CREDIT
RCONHJ94,COMMERCIAL AND SIMILAR LETTERS OF CR
RCON3822,AMT OF PERFORMANCE STANDBY LETTERS
RCONN047,2YR PRB DFLT CRDT CRD LN  18-20 PCT
RCFDF165,CMRL RE OTHR CNSTRCTN LN & LND DEV L
RCFDG615,RETAINED RESOURCE ON SMALL BUSINESS
RCONG582,3RD GT $25K 25PCT OTHR LIAB LESS DTR
RCONK037,LN GUAR US , EXCLUD FDIC PD 90
RCFDG423,OTC FV CSH USD BK & SCTY FIRM
Unnamed: 29,nan
RCONHK26,TOTAL LOANS RESTRUCTURED IN TROUBLED
RCFDS586,NOTIONAL PRINCIPROUGH FIVE YEARS
RCFDS466,TRADING ASSETS
RCFDG603,PERFORMANCE STANDBY LETTERS OF CREDI
RCFDS461,LOANS AND LEASES WEIGHT CATEGORY
